{"schemaVersion":1,"engineVersion":2,"revision":2,"sources":[{"id":"novel.kolnovel","domain":"kolnovel.com","selectors":{"catalogCards":"article.maindet","catalogTitle":".mdinfo h2 a, h2 a","catalogCover":".mdthumb img","detailsTitle":"h1.entry-title","detailsCover":".sertothumb img","description":".sersys[itemprop=description]","text":"#kol_content","originalTitle":".alter"}},{"id":"novel.cenele","domain":"cenele.com","selectors":{"catalogCards":".nhv-library-card__cover, .nhv-cover, .tab-thumb a, .item-thumb a","detailsTitle":"h1.nhv-novel-title","detailsCover":".nhv-novel-cover img","description":".nhv-novel-synopsis","text":".reading-content","originalTitle":".nhv-novel-kicker"}},{"id":"novel.sunovels","domain":"sunovels.com","selectors":{"catalogCards":".list-item a[href^=\"/novel/\"]","description":".description","text":".chapter-content","originalTitle":".main-head h1"}},{"id":"novel.seanovel","domain":"seanovel.org","selectors":{"text":"article.reader-content"}}]}